{
  "artifact_type": "visual-authority",
  "authority_id": "VA-neutral-starter",
  "source_ref_id": "SRC-neutral-starter",
  "mode": "text-only",
  "authority_scope": "template-only-no-authority",
  "source_sha256": "0000000000000000000000000000000000000000000000000000000000000000",
  "source_media_type": "application/octet-stream",
  "source_dimensions": {
    "width": 1,
    "height": 1
  },
  "archival_vector": null,
  "canonical_record_refs": [],
  "notes": [
    "Template values have no authority; replace the source identity, dimensions, media type, hashes, and record bindings only after reviewing real evidence.",
    "A completed source-derived artifact may assert authority only for the reviewed source used at derivation time."
  ],
  "visual_authority_sha256": "0000000000000000000000000000000000000000000000000000000000000000"
}
